{
  "schema_version": 4,
  "project": "Omenward",
  "base_source": {
    "repository": "alsdmlals4-eng/Base",
    "commit": "41a20584dd2ee51d917e5c9d7cab6838e1ceba7e",
    "synced_on": "2026-07-22",
    "policy": "project_canon_first_explicit_adoption_no_auto_overwrite"
  },
  "shared_contract": "skills/SHARED_EXECUTION_CONTRACT.md",
  "capability_coverage": "docs/base/BASE_CAPABILITY_COVERAGE.json",
  "legacy_aliases": "skills/LEGACY_SKILL_ALIASES.json",
  "routing": {
    "strategy": "stage_aware_automatic_trigger_routing",
    "work_modes": [
      "PLAN",
      "BUILD",
      "REVIEW"
    ],
    "default_sequence": [
      "PLAN"
    ],
    "entry_stack": [
      "foundation.project-intake"
    ],
    "review_stack": [
      "foundation.adversarial-review",
      "foundation.validation-review",
      "discipline.integration-review"
    ],
    "max_primary_disciplines": 1,
    "max_support_disciplines": 2,
    "max_foundation_skills_per_stage": 7,
    "manual_override_requires_registered_or_alias_id": true
  },
  "selected_disciplines": [
    "discipline.narrative",
    "discipline.game-design",
    "discipline.ux-ui-accessibility",
    "discipline.engineering",
    "discipline.technical-art",
    "discipline.art",
    "discipline.audio",
    "discipline.qa",
    "discipline.production-pm",
    "discipline.analytics-research",
    "discipline.integration-review"
  ],
  "skills": [
    {
      "id": "foundation.project-intake",
      "category": "foundation",
      "path": "skills/foundation/managing-project-intake-and-work-contract/SKILL.md",
      "work_modes": [
        "PLAN",
        "BUILD",
        "REVIEW"
      ],
      "modes": [
        "route",
        "clarify",
        "contract",
        "decompose-sequence",
        "execution-report"
      ],
      "mode_triggers": {
        "route": [
          "요청",
          "작업",
          "request",
          "task"
        ],
        "clarify": [
          "불명확",
          "확인 필요",
          "ambiguous"
        ],
        "contract": [
          "범위",
          "완료 기준",
          "계약",
          "acceptance"
        ],
        "decompose-sequence": [
          "의존성",
          "작업 분해",
          "순서",
          "병렬",
          "dependency"
        ],
        "execution-report": [
          "결과 보고",
          "완료 보고",
          "evidence report"
        ]
      },
      "default_modes": {
        "PLAN": [
          "route",
          "contract"
        ],
        "BUILD": [
          "contract"
        ],
        "REVIEW": [
          "execution-report"
        ]
      },
      "triggers": [
        "요청",
        "작업",
        "변경",
        "구현",
        "검토",
        "기획",
        "request",
        "task",
        "change"
      ],
      "depends_on": [],
      "priority": 100,
      "required_modes": {},
      "mode_work_modes": {
        "route": [
          "PLAN"
        ],
        "clarify": [
          "PLAN"
        ],
        "contract": [
          "PLAN",
          "BUILD"
        ],
        "decompose-sequence": [
          "PLAN"
        ],
        "execution-report": [
          "REVIEW"
        ]
      }
    },
    {
      "id": "foundation.project-operating-system",
      "category": "foundation",
      "path": "skills/foundation/managing-game-project-operating-system/SKILL.md",
      "work_modes": [
        "PLAN",
        "BUILD",
        "REVIEW"
      ],
      "modes": [
        "audit",
        "reconcile-legacy",
        "migrate",
        "verify",
        "sync-local-github",
        "external-ai-worktree"
      ],
      "mode_triggers": {
        "audit": [
          "감사",
          "audit",
          "전부 읽",
          "대조"
        ],
        "reconcile-legacy": [
          "구형",
          "중복",
          "legacy",
          "stale",
          "v2",
          "final"
        ],
        "migrate": [
          "반영",
          "이주",
          "마이그레이션",
          "sync base"
        ],
        "verify": [
          "정상",
          "검증",
          "health",
          "콜드 스타트"
        ],
        "sync-local-github": [
          "GitHub",
          "git sync",
          "diverged",
          "branch",
          "원격",
          "로컬"
        ],
        "external-ai-worktree": [
          "DeepSeek",
          "외부 AI",
          "worktree",
          "병렬 분석"
        ]
      },
      "default_modes": {
        "PLAN": [
          "audit"
        ],
        "BUILD": [
          "migrate"
        ],
        "REVIEW": [
          "verify"
        ]
      },
      "triggers": [
        "Base",
        "운영체계",
        "폴더 구조",
        "registry",
        "schema",
        "automation",
        "governance",
        "마이그레이션",
        "GitHub",
        "git sync",
        "diverged",
        "worktree",
        "DeepSeek",
        "외부 AI"
      ],
      "depends_on": [
        "foundation.project-intake"
      ],
      "priority": 95,
      "required_modes": {
        "REVIEW": [
          "verify"
        ]
      },
      "mode_work_modes": {
        "audit": [
          "PLAN",
          "REVIEW"
        ],
        "reconcile-legacy": [
          "PLAN"
        ],
        "migrate": [
          "BUILD"
        ],
        "verify": [
          "REVIEW"
        ],
        "sync-local-github": [
          "PLAN",
          "BUILD",
          "REVIEW"
        ],
        "external-ai-worktree": [
          "PLAN",
          "BUILD"
        ]
      }
    },
    {
      "id": "foundation.design-documents",
      "category": "foundation",
      "path": "skills/foundation/managing-design-documents/SKILL.md",
      "work_modes": [
        "PLAN",
        "BUILD",
        "REVIEW"
      ],
      "modes": [
        "author",
        "update",
        "restructure",
        "publish",
        "validate",
        "learning-note",
        "visual-dashboard"
      ],
      "mode_triggers": {
        "author": [
          "새 문서",
          "작성",
          "author"
        ],
        "update": [
          "갱신",
          "수정",
          "update"
        ],
        "restructure": [
          "재구조화",
          "이동",
          "통합",
          "restructure"
        ],
        "publish": [
          "PDF",
          "발행",
          "manifest",
          "publish"
        ],
        "validate": [
          "문서 검수",
          "발행 검증"
        ],
        "learning-note": [
          "학습 노트",
          "공부 노트",
          "설명 자료"
        ],
        "visual-dashboard": [
          "대시보드",
          "HTML dashboard",
          "시각화"
        ]
      },
      "default_modes": {
        "PLAN": [
          "author"
        ],
        "BUILD": [
          "update"
        ],
        "REVIEW": [
          "validate"
        ]
      },
      "triggers": [
        "기획서",
        "GDD",
        "문서",
        "승인 문서",
        "정본",
        "proposal",
        "spec",
        "documentation",
        "PDF",
        "manifest",
        "학습 노트",
        "공부 노트",
        "대시보드",
        "HTML dashboard"
      ],
      "depends_on": [
        "foundation.project-intake"
      ],
      "priority": 90,
      "required_modes": {},
      "mode_work_modes": {
        "author": [
          "PLAN",
          "BUILD"
        ],
        "update": [
          "BUILD"
        ],
        "restructure": [
          "PLAN",
          "BUILD"
        ],
        "publish": [
          "BUILD"
        ],
        "validate": [
          "REVIEW"
        ],
        "learning-note": [
          "BUILD"
        ],
        "visual-dashboard": [
          "BUILD"
        ]
      }
    },
    {
      "id": "foundation.context-handoff",
      "category": "foundation",
      "path": "skills/foundation/maintaining-project-context-and-handoff/SKILL.md",
      "work_modes": [
        "PLAN",
        "BUILD",
        "REVIEW"
      ],
      "modes": [
        "active-context",
        "handoff",
        "initialize",
        "checkpoint",
        "resume",
        "partial-delivery",
        "close"
      ],
      "mode_triggers": {
        "active-context": [
          "active context",
          "상태 캡슐"
        ],
        "handoff": [
          "handoff",
          "인수인계"
        ],
        "initialize": [
          "긴 작업 시작",
          "initialize"
        ],
        "checkpoint": [
          "checkpoint",
          "중간 상태"
        ],
        "resume": [
          "resume",
          "작업 재개"
        ],
        "partial-delivery": [
          "부분 전달",
          "미완료"
        ],
        "close": [
          "close",
          "완료 정리"
        ]
      },
      "default_modes": {
        "PLAN": [
          "initialize"
        ],
        "BUILD": [
          "checkpoint"
        ],
        "REVIEW": [
          "close"
        ]
      },
      "triggers": [
        "handoff",
        "인수인계",
        "active context",
        "작업 재개",
        "요약",
        "상태 캡슐",
        "긴 작업",
        "checkpoint",
        "resume",
        "부분 전달",
        "context limit"
      ],
      "depends_on": [],
      "priority": 85,
      "required_modes": {},
      "mode_work_modes": {
        "active-context": [
          "BUILD",
          "REVIEW"
        ],
        "handoff": [
          "BUILD",
          "REVIEW"
        ],
        "initialize": [
          "PLAN"
        ],
        "checkpoint": [
          "BUILD"
        ],
        "resume": [
          "PLAN"
        ],
        "partial-delivery": [
          "REVIEW"
        ],
        "close": [
          "REVIEW"
        ]
      }
    },
    {
      "id": "foundation.validation-review",
      "category": "foundation",
      "path": "skills/foundation/reviewing-and-validating-project-changes/SKILL.md",
      "work_modes": [
        "REVIEW"
      ],
      "modes": [
        "contract-check",
        "external-source-review",
        "reference-freshness",
        "static-validation",
        "runtime-validation",
        "accessibility-review",
        "performance-profile",
        "regression",
        "evidence-report"
      ],
      "mode_triggers": {